{
  "id": "ai-analysis",
  "name": "AI 分析",
  "version": "0.2.1",
  "apiVersion": 1,
  "entry": "index.js",
  "enabled": true,
  "priority": 50,
  "description": "通过 OpenAI 兼容接口逐章生成摘要与关键原文，抽取人物、物品、地点、势力、事件与伏笔，按卷归并并汇总为全书大纲与设定集；结果按书保存在本地插件存储，可导出 JSON/Markdown。",
  "author": "Novel-Disassembly",
  "hooks": []
}
