{
  "id": "clean-annotations",
  "name": "去除更新标注",
  "version": "0.1.0",
  "apiVersion": 1,
  "entry": "index.js",
  "enabled": false,
  "priority": 100,
  "description": "去掉标题末尾的（为…加更）、（庆祝…加更）、（N月月票…）等括号标注，并提供 cleanTitle 变量。默认停用，不改变原有导出结果。",
  "author": "Novel-Disassembly",
  "hooks": ["normalizeEntry", "defineVariables"]
}
